{
  "schema_version": "1.0.0",
  "benchmark_version": "0.1.0",
  "task_family": "optimistic-concurrency",
  "language": "python",
  "typecheck_config": "none",
  "repo_revision": "7410b82c9e44bb205fdc2438a9339c78651fd78f",
  "container_image_digest": "sha256:8b86aca1660e645a9098d8f909b4b2282802244e65018102ec51e05e910b14f4",
  "model": "mock/solve",
  "model_settings": {
    "reasoning_effort": "none"
  },
  "scaffold": "local-mock/bash-only-compatible",
  "agent_version": "mock-solve",
  "pier_version": "not-invoked-local-mock",
  "malformed_action_count": 0,
  "run_id": "350e3e38-91a7-4ad7-bf95-5f8fe0c96859",
  "seed": 0,
  "order_index": 2,
  "toolchain_versions": {},
  "started_at": "2026-08-24T20:00:29.405046+00:00",
  "ended_at": "2026-08-24T20:00:29.560325+00:00",
  "verifier_case_results": [
    {
      "case_id": "regression-crud",
      "passed": true,
      "duration_ms": 16.0
    },
    {
      "case_id": "etag-stable",
      "passed": true,
      "duration_ms": 16.0
    },
    {
      "case_id": "if-match-required",
      "passed": true,
      "duration_ms": 0.0
    },
    {
      "case_id": "matching-tag-changes",
      "passed": true,
      "duration_ms": 15.0
    },
    {
      "case_id": "stale-write",
      "passed": true,
      "duration_ms": 31.0
    },
    {
      "case_id": "concurrent-conflict",
      "passed": true,
      "duration_ms": 16.0
    },
    {
      "case_id": "deleted-stale",
      "passed": true,
      "duration_ms": 16.0
    }
  ],
  "regression_results": [
    {
      "case_id": "regression-crud",
      "passed": true,
      "duration_ms": 16.0
    }
  ],
  "calibration_ref": "calibration_report.json",
  "usage": {
    "input_tokens": 0,
    "output_tokens": 0,
    "cached_input_tokens": 0,
    "max_context_occupancy": 0,
    "tool_output_tokens": 0
  },
  "cache_hit_rate": 0,
  "measured_cost_usd": 0,
  "rate_card": {
    "input_per_million": 0,
    "cached_input_per_million": 0,
    "output_per_million": 0,
    "currency": "USD"
  },
  "command_counts": {
    "shell": 1,
    "edit": 1,
    "test": 1,
    "build_or_typecheck": 0
  },
  "feedback_to_fix_events": [],
  "patch_statistics": {
    "files_modified": 1,
    "lines_added": 20,
    "lines_deleted": 0
  },
  "terminal_stage": "passed",
  "root_causes": [],
  "stopped_reason": "completed",
  "exit_status": 0
}
